AimID,ProjectID,Name,Description
1,1,1,Evaluate coordination between home visitation programs and other support services
2,1,2,Evaluate outreach effort of MIECHV-funded marketing strategies
3,1,3,Evaluate engagement and retention of clients in EBHV services
4,1,4,Evaluate overall need for child and family services among disadvantaged early childhood populations within each community
5,1,5,Establish a quality improvement and control system and evaluate effectiveness of the home visitation and early childhood services continuum
